{
  "schemaVersion": "4.1.0",
  "asOf": "2026-10-16",
  "classification": "INDEPENDENT CIVILIAN ECONOMIC RESEARCH — NO AUTHORIZATION, OFFERS, OR FUNDS",
  "responsibilityStatement": "Russia initiated the full-scale invasion of Ukraine; the OS does not equate Russian financing of aggression with Ukrainian self-defence or external assistance consistent with international law. Accountability, reparations, sovereignty and victim rights remain non-negotiable boundaries of this analytic framework.",
  "rules": [
    "Humanitarian protection cannot depend on ceasefire bargains, sanctions relief or diplomatic concessions.",
    "Pledged, appropriated, committed, disbursed and adjudicated compensation funds are different states. Do not add them together as available cash.",
    "Sanctioned or restricted funds and parties require jurisdiction-specific legal review; no transfer routes or evasion tools.",
    "Ukrainian government and affected communities control locally approved implementation; no coercive equal governance arrangement is assumed.",
    "Reciprocal cooperation is contingent on competent authorization, explicit consent and independent verification.",
    "The OS models public-interest options only; it never transfers money, makes solicitations, sends messages or predicts real actors’ preferences."
  ],
  "modes": [
    {
      "id": "parallel-now",
      "label": "Parallel civilian investment now",
      "description": "Separate lawful actions may proceed independently without bilateral permission."
    },
    {
      "id": "reciprocal-conditional",
      "label": "Conditioned reciprocal confidence-building",
      "description": "Requires a narrowly specified authorized agreement and independently reviewed compliance."
    },
    {
      "id": "post-agreement",
      "label": "Post-agreement cooperation only",
      "description": "Cross-party projects wait for legal settlement, safe access and competent approval."
    }
  ],
  "funderKinds": [
    {
      "id": "russian-state",
      "title": "Russian state and state-linked war finance",
      "constraint": "Responsibility for aggression and the international claims/reparations framework are not exchangeable for co-investment or recognition."
    },
    {
      "id": "ukrainian-state",
      "title": "Ukrainian government and defensive budget",
      "constraint": "Ukraine retains sovereignty and its right of self-defence; reconstruction and protection are not conditional on voluntary disarmament."
    },
    {
      "id": "allied-states",
      "title": "Ukraine-supporting states and public financing",
      "constraint": "Defense and civilian aid streams have distinct legal purposes; scenario cannot simply reassign appropriations."
    },
    {
      "id": "third-country-flows",
      "title": "Third-country buyers, intermediaries and financiers",
      "constraint": "Screen sanctions, beneficial ownership, export controls and conflict exposure before any engagement."
    },
    {
      "id": "defense-industry",
      "title": "Defense manufacturers, banks and suppliers",
      "constraint": "Only voluntary, lawful civilian diversification with export control screening and worker protections."
    },
    {
      "id": "multilateral-finance",
      "title": "Multilateral development banks and trust funds",
      "constraint": "Mandates, fiduciary obligations and government ownership constrain deployment."
    },
    {
      "id": "private-capital",
      "title": "Private capital, insurers and philanthropy",
      "constraint": "Avoid profit extraction, exploitative debt, greenwashing, unconsented risk or displacement."
    },
    {
      "id": "local-communities",
      "title": "Ukrainian communities, cooperatives and municipalities",
      "constraint": "Local consent, participation, national law, protection, and Ukrainian public-investment frameworks govern projects."
    }
  ],
  "alternatives": [
    {
      "id": "reparations-ledger",
      "title": "Evidence-first reparations and environmental recovery",
      "stakeholderKinds": [
        "russian-state",
        "ukrainian-state",
        "multilateral-finance"
      ],
      "cooperationMode": "post-agreement",
      "fundingClass": "subject-to-legal-resolution",
      "mechanism": "Maintain an auditable damage-claims-to-recovery sequence without treating victim compensation as negotiable sponsorship.",
      "proposedFunding": "Potential adjudicated or otherwise legally established reparations; no principal release or confiscation is assumed.",
      "steps": [
        "Document environmental and infrastructure damages through accepted claimant channels.",
        "Identify which claims are registered, assessed, and adjudicated separately.",
        "Propose protected disbursement controls for Ukrainian-led recovery only after valid legal authority."
      ],
      "legalGate": "Claims recording is not a payment award. Avoid claims of bilateral consent, waivers of rights or settlement immunity.",
      "metrics": [
        "Eligible damage claims recorded by independent process (count, not paid claims)",
        "Recovery projects with published independent audits (count)",
        "Share of funded projects with community consultation (defined denominator)"
      ],
      "stopCondition": "Freeze proposed disbursement if authority, claimant rights, legal attribution, or asset title are disputed.",
      "sourceIds": [
        "rd4u-register-2026",
        "rd4u-commission-2026",
        "rdna5-2026"
      ],
      "classification": "UNVERIFIED INDEPENDENT POLICY OPTION — NOT APPROVED OR FUNDED"
    },
    {
      "id": "dual-budget-windows",
      "title": "Distinct defensive continuity and civilian recovery windows",
      "stakeholderKinds": [
        "ukrainian-state",
        "allied-states",
        "multilateral-finance"
      ],
      "cooperationMode": "parallel-now",
      "fundingClass": "authorized-existing",
      "mechanism": "Enable additional civilian reconstruction commitments without pressuring Ukraine to give up lawful defence or reclassifying restricted public budgets.",
      "proposedFunding": "Existing authorized humanitarian, reconstruction, bilateral and multilateral appropriations, separately controlled.",
      "steps": [
        "Map appropriations and legal restrictions for defense and civilian recovery separately.",
        "Identify eligible recovery projects through Ukrainian-led priorities and existing funders.",
        "Publish an additionality and impact matrix reviewed by Ukrainian agencies and donors."
      ],
      "legalGate": "No automatic reallocation of security assistance; only duly authorized financing decisions.",
      "metrics": [
        "Civilian funding additionality versus a documented baseline",
        "Approved repair projects completed after quality inspection",
        "Number of civilian service users restored with defined methodology"
      ],
      "stopCondition": "Halt if budget shifts weaken civilian protection or misstate donor pledges as payments.",
      "sourceIds": [
        "worldbank-urtf-2026",
        "rdna5-2026"
      ],
      "classification": "UNVERIFIED INDEPENDENT POLICY OPTION — NOT APPROVED OR FUNDED"
    },
    {
      "id": "conditional-energy-infrastructure",
      "title": "Mutual civilian energy protection and green-grid repair",
      "stakeholderKinds": [
        "russian-state",
        "ukrainian-state",
        "allied-states",
        "multilateral-finance"
      ],
      "cooperationMode": "reciprocal-conditional",
      "fundingClass": "voluntary-proposed",
      "mechanism": "Pair independently verified non-attack commitments affecting civilian energy services with Ukrainian-led clean-grid restoration and microgrid resilience.",
      "proposedFunding": "Authorized utility recovery grants, climate finance, and voluntary project financing; no quid pro quo for humanitarian rights.",
      "steps": [
        "Seek separately authorized technical consultations on civilian services.",
        "Define safe delayed reporting and independent incident-review thresholds.",
        "Advance Ukrainian-owned recovery procurement independent of unverifiable promises."
      ],
      "legalGate": "Party consent and credible monitoring required for reciprocal obligations; no acceptance of attacks on civilians outside deal scope.",
      "metrics": [
        "Verified civilian service interruption hours (baseline-normalized)",
        "Independently assessed repairs reaching service",
        "Share of new generation with resilience and environmental screening"
      ],
      "stopCondition": "Pause joint components after material unreviewed compliance breaches or unsafe infrastructure disclosures.",
      "sourceIds": [
        "worldbank-urtf-2026",
        "undp-local-finance",
        "rdna5-2026"
      ],
      "classification": "UNVERIFIED INDEPENDENT POLICY OPTION — NOT APPROVED OR FUNDED"
    },
    {
      "id": "accredited-mine-food",
      "title": "Accredited mine action to regenerative food systems",
      "stakeholderKinds": [
        "ukrainian-state",
        "allied-states",
        "multilateral-finance",
        "local-communities"
      ],
      "cooperationMode": "parallel-now",
      "fundingClass": "authorized-existing",
      "mechanism": "Link nationally accredited mine-action land-release decisions to safe soil restoration, agroforestry, agricultural livelihoods and biodiversity recovery.",
      "proposedFunding": "Authorized humanitarian mine-action grants, agriculture recovery investment and formally assessed outcome-financing pilots.",
      "steps": [
        "Partner with accredited mine-action authorities for non-sensitive, aggregate release milestones.",
        "Design locally requested food/soil/watershed restoration on formally released land.",
        "Audit livelihood effects, land rights, contamination safeguards and maintenance funding."
      ],